{
  "profile_id": "default",
  "version": "1.0.0",
  "scoring_version": "1.0.0",
  "effective_at": "2026-04-22T00:00:00Z",
  "superseded_at": null,
  "components": {
    "token_divisor": "500",
    "duration_seconds_divisor": "2",
    "step_weight": "2",
    "tool_weight": "3",
    "artifact_weight": "1.5",
    "artifact_cap": 20,
    "output_default_weight": "1",
    "review_weight": "4"
  },
  "category_multipliers": {
    "uncategorized": "1.0",
    "summarization": "0.9",
    "drafting": "1.0",
    "code_generation": "1.2",
    "root_cause_analysis": "1.4",
    "planning_architecture": "1.5",
    "regulated_decision_support": "1.6"
  },
  "category_output_weights": {
    "uncategorized": "1.0",
    "summarization": "0.8",
    "drafting": "1.0",
    "code_generation": "1.2",
    "root_cause_analysis": "1.0",
    "planning_architecture": "1.4",
    "regulated_decision_support": "1.4"
  },
  "category_review_weights": {
    "uncategorized": "4",
    "summarization": "2",
    "drafting": "3",
    "code_generation": "5",
    "root_cause_analysis": "6",
    "planning_architecture": "8",
    "regulated_decision_support": "10"
  },
  "context_multipliers": {
    "retry_per_unit": "0.25",
    "retry_cap": "2.0",
    "ambiguity_high_temp": "1.1",
    "ambiguity_temp_threshold": "0.7",
    "risk_high": "1.2",
    "risk_medium": "1.0",
    "risk_low": "1.0",
    "human_in_loop": "0.7",
    "outcome": {
      "success": "1.0",
      "partial_success": "0.6",
      "failure": "0.25",
      "timeout": "0.2"
    }
  },
  "confidence": {
    "base": "0.95",
    "missing_category_penalty": "0.10",
    "missing_tokens_penalty": "0.15",
    "missing_steps_penalty": "0.05",
    "missing_tools_penalty": "0.05",
    "retry_penalty_per_unit": "0.05",
    "retry_penalty_cap": "0.20",
    "high_risk_cap": "0.85",
    "min": "0.0",
    "max": "1.0"
  },
  "rounding": {
    "minutes_dp": 2,
    "hours_dp": 2,
    "days_dp": 2,
    "fec_dp": 2,
    "confidence_dp": 4
  }
}
